<?xml version="1.0" encoding="UTF-8"?>
<placeDetailsResponse xmlns="http://xmlns.data.generator.com/gplace/api/v1"
	xmlns:xsi="http://www.w3.org/2001/XMLSchema-instance"
	xsi:schemaLocation="http://xmlns.data.generator.com/gplace/api/v1 data-generator-gplace-api.xsd ">
	<status>token</status>
	<result>
		<addressComponent>
			<type>token</type>
			<longName>token</longName>
			<shortName>token</shortName>
		</addressComponent>
		<name>token</name>
		<vicinity>token</vicinity>
		<type>token</type>
		<formattedPhoneNumber>token</formattedPhoneNumber>
		<formattedAddress>token</formattedAddress>
		<event>
			<eventId>token</eventId>
			<startTime>token</startTime>
			<summary>token</summary>
			<url>token</url>
		</event>
		<geometry>
			<location>
				<lat>0.0</lat>
				<lng>0.0</lng>
			</location>
		</geometry>
		<url>token</url>
		<icon>token</icon>
		<reference>token</reference>
		<id>token</id>
		<internationalPhoneNumber>token</internationalPhoneNumber>
		<website>token</website>
		<review>
			<aspect>
				<type>token</type>
				<rating>0.0</rating>
			</aspect>
			<authorName>token</authorName>
			<authorUrl>token</authorUrl>
			<language>token</language>
			<rating>0.0</rating>
			<text>token</text>
			<time>token</time>
		</review>
		<openingHours>
			<openNow>true</openNow>
			<period>
				<open>
					<day>0</day>
					<time>token</time>
				</open>
				<close>
					<day>0</day>
					<time>token</time>
				</close>
			</period>
		</openingHours>
		<utcOffset>token</utcOffset>
		<photo>
			<photoReference>token</photoReference>
			<height>token</height>
			<width>token</width>
			<htmlAttribution>token</htmlAttribution>
		</photo>
		<priceLevel>0</priceLevel>
		<rating>0.0</rating>
		<adrAddress>token</adrAddress>
		<userRatingsTotal>0</userRatingsTotal>
	</result>
</placeDetailsResponse>
